{
  "$schema": "https://json-schema.org/draft/2020-12/schema",
  "$id": "https://williamzujkowski.github.io/remarque/registry.schema.json",
  "title": "Remarque markup-contract registry index",
  "description": "JSON Schema for registry.json — GENERATED by scripts/build-registry.mjs, do not hand-edit. Vendored and adapted from shadcn/ui's registry.json (https://ui.shadcn.com/schema/registry.json): `name`/`homepage`/`items` are kept; `include` (chunked multi-file registries) is omitted — Remarque's registry is small enough to stay one index file. DIVERGENCE from shadcn: shadcn's `items` embeds each FULL registry-item object inline. This index instead lists a lightweight pointer per item (name/type/title/description/version/integrity/file) and leaves the full payload — including all file content — in registry/<name>.json only. Embedding full CSS/HTML content in both the index and the per-item file would mean two copies of the same bytes that could silently drift; the index exists so a consumer can discover what's available and its pinned version+hash WITHOUT fetching every item's full payload, then fetch only the item(s) it needs.",
  "type": "object",
  "additionalProperties": false,
  "required": ["$schema", "name", "homepage", "version", "items"],
  "properties": {
    "$schema": { "type": "string" },
    "name": { "type": "string", "description": "The registry name — \"remarque-tokens\"." },
    "homepage": { "type": "string", "pattern": "^https://", "description": "SECURITY: HTTPS-only, checked by scripts/test-registry.mjs." },
    "version": { "type": "string", "description": "The remarque-tokens package version this index was generated from. Every entry in `items` carries this same version (scripts/test-registry.mjs asserts they match) — the whole registry is generated in one pass from one package version, never a mix." },
    "items": {
      "type": "array",
      "minItems": 1,
      "items": { "$ref": "#/$defs/indexEntry" }
    }
  },
  "$defs": {
    "indexEntry": {
      "type": "object",
      "additionalProperties": false,
      "required": ["name", "type", "title", "description", "version", "integrity", "file"],
      "properties": {
        "name": { "type": "string", "pattern": "^[a-z][a-z0-9-]*$" },
        "type": { "type": "string", "enum": ["remarque:contract"] },
        "title": { "type": "string" },
        "description": { "type": "string" },
        "version": { "type": "string", "description": "SECURITY: pinned version, mirrors the full item's `version` at `file`." },
        "integrity": {
          "type": "string",
          "pattern": "^sha256-[A-Za-z0-9+/]+=*$",
          "description": "SECURITY: mirrors the full item's `integrity` at `file` — a consumer can check this before deciding whether to fetch the full payload at all, and must recheck it against the fetched payload either way."
        },
        "file": { "type": "string", "pattern": "^registry/[a-z0-9-]+\\.json$", "description": "Path (relative to this index) to the full registry item — registry/<name>.json." }
      }
    }
  }
}
