{
  "$schema": "https://williamzujkowski.github.io/remarque/registry.schema.json",
  "name": "remarque-tokens",
  "homepage": "https://williamzujkowski.github.io/remarque/",
  "version": "0.31.0",
  "items": [
    {
      "name": "essay",
      "type": "remarque:contract",
      "title": "Essay Module",
      "description": "Sidenotes + sticky TOC rail for long-form Essay pages: margin notes relocated into real DOM order, right after the paragraph that cites them, numbered by CSS counter and labeled `aria-label=\"Note N\"` in the same order the counter advances — the mechanism that prevents the sidenote aria-label/DOM-order transcription bug found in the flagship migration (#89, williamzujkowski.github.io#380).",
      "version": "0.31.0",
      "integrity": "sha256-HwTP/hiT/oid/YHBlzSECSvG5wSg9ICYVfns7luc6SA=",
      "file": "registry/essay.json"
    },
    {
      "name": "broadsheet",
      "type": "remarque:contract",
      "title": "Broadsheet Pattern",
      "description": "The editorial Landing/archive pattern: masthead, lead article, numbered entry list, and post-header kicker. Entry numerals are generated from `data-entry-number` via `attr()`, never `counter()`, and every kicker/dateline row is the label voice: tracked capitals, because the default mono face has no small caps (`font-variant-caps: all-small-caps` only on a face with `smcp` + `c2sc`; remarque-audit checks).",
      "version": "0.31.0",
      "integrity": "sha256-0gdOLXhIStXi2nrbSvWuyaOvCfjAdTdJAeZkprafekU=",
      "file": "registry/broadsheet.json"
    },
    {
      "name": "forms",
      "type": "remarque:contract",
      "title": "Forms Primitives",
      "description": "Native field/input/checkbox/radio/button primitives with state-color wiring. Every `.remarque-input` pairs `for`/`id` with its `.remarque-field-label`, and every `.remarque-field-message` is wired via `aria-describedby` on the control — the paint-layer `data-state` attribute is never the only signal; `aria-invalid`/`aria-describedby` on the input carry the real accessibility contract.",
      "version": "0.31.0",
      "integrity": "sha256-5Ej+gAhlA9KPROSSb+x5SeYC8BPI/b0GgRYCxd7KiLM=",
      "file": "registry/forms.json"
    },
    {
      "name": "skip-link",
      "type": "remarque:contract",
      "title": "Skip Link (chrome.css)",
      "description": "The first focusable element in <body>: `.remarque-skip-link` targets `<main id=\"main-content\" tabindex=\"-1\">`, visually hidden by clip-path (never an off-screen offset) until focused, then a filled fg-on-bg block on `--z-skip-link`. Ships with `.remarque-sr-only`. Shares chrome.css with the breadcrumb, pager and tags items.",
      "version": "0.31.0",
      "integrity": "sha256-38RmGUKk28JsO88LYrB2UqEbB9qG1pS+Ac7zHKF4oWI=",
      "file": "registry/skip-link.json"
    },
    {
      "name": "breadcrumb",
      "type": "remarque:contract",
      "title": "Breadcrumb (chrome.css)",
      "description": "The Reference/Docs breadcrumb kicker: `nav[aria-label=\"Breadcrumb\"] > ol`, the current page last as `<span aria-current=\"page\">` (never a link), separators generated by CSS with empty alt text and never typed into the DOM.",
      "version": "0.31.0",
      "integrity": "sha256-5arpTNPmZZj37CZG01MNawoRmwHAok7kZtfVgSX5uR4=",
      "file": "registry/breadcrumb.json"
    },
    {
      "name": "pager",
      "type": "remarque:contract",
      "title": "Pager and Pagination (chrome.css)",
      "description": "Prev/next between adjacent pages with `rel=\"prev\"`/`rel=\"next\"`, an optional series row (\"Part N of M\" plus a <details> list with the current part `aria-current=\"page\"`), and numbered `.remarque-pagination`. An endpoint with nowhere to go is omitted or plain text, never a disabled-looking link that stays focusable.",
      "version": "0.31.0",
      "integrity": "sha256-sPTGBItiTW+8edikmBmBltd8/1erLcjVr9PlOCAPc9A=",
      "file": "registry/pager.json"
    },
    {
      "name": "tags",
      "type": "remarque:contract",
      "title": "Tags (chrome.css)",
      "description": "Tags as plain mono links in a `<ul>` with an accessible name, each `rel=\"tag\"`. No border, fill or radius: an outlined or filled chip is a documented deviation, not personalization.",
      "version": "0.31.0",
      "integrity": "sha256-0pBOh9IpFlNi4ddwuuuJ5WBq/40HqYhil2ydJtBb3Bs=",
      "file": "registry/tags.json"
    },
    {
      "name": "deck-picker",
      "type": "remarque:contract",
      "title": "Palette Picker (chrome.css + remarque-tokens/deck)",
      "description": "A reader’s choice of color theme: a <details> holding a <fieldset> of native radio inputs (keyboard-operable with no ARIA-radio script), one per palette in deck.json plus value=\"\" for the site’s own. Swatches are aria-hidden and colored by deck.css ([data-palette-swatch=\"<name>\"]). Wire with deck.js bindPicker(); the module ships no script in this item.",
      "version": "0.31.0",
      "integrity": "sha256-o+JEdfqmM6nHRV9BNeKaUC2RlJMglYb/mm7JR25SY8E=",
      "file": "registry/deck-picker.json"
    },
    {
      "name": "palette-deck",
      "type": "remarque:contract",
      "title": "Palette Deck (markup contract only — no executable content)",
      "description": "Markup/wiring contract for the Palette Deck: set `data-palette` on the same root element as `data-theme` and the two compose independently. This item ships ONLY that HTML fragment. `deck.js` — the runtime module itself, a dependency-free ~60-line ESM file — is deliberately NOT embedded here: the registry’s blocking no-executable-content condition is held to an unambiguous zero-`<script>`-tag bar across every item, so neither `deck.js` nor the FOUC-restore `<script>` sample documented alongside it in REMARQUE.md is included. Consume `deck.js` the normal way, via the `remarque-tokens/deck` package import (`dependencies` below); read the FOUC-restore snippet from the `docs` URL.",
      "version": "0.31.0",
      "integrity": "sha256-WGgBZ2j0VnLPRAZlzv/4G1Wu9rKqTdXf1536dWWu8nU=",
      "file": "registry/palette-deck.json"
    }
  ]
}
